Soort;Code;Naam;Omschrijving;Begindatum;Einddatum;Parent;Informatiedomein
RUIMTEDETAILSOORT;OVL;Overloop;Verkeersruimte: (UITBREIDING) Gang op een bovenverdieping.;3-4-2024;;RUIMTESOORT.VRK;Vastgoed
RUIMTEDETAILSOORT;ENT;Entree;Verkeersruimte: (UITBREIDING) Ingang van een gebouw.;3-4-2024;;RUIMTESOORT.VRK;Vastgoed
RUIMTEDETAILSOORT;KAS;Kast;Overige ruimte: (UITBREIDING);8-4-2024;;RUIMTESOORT.OVR;Vastgoed
RUIMTEDETAILSOORT;TRH;Trappenhuis;Verkeersruimte: (UITBREIDING) Verkeersruimte waarin een trap ligt;27-8-2024;;RUIMTESOORT.VRK;Vastgoed
RUIMTEDETAILSOORT;PIP;Parkeerplek in inpandige afgesloten parkeergarage;Parkeerplek in inpandige en afgesloten parkeergarage behorend tot het complex met niet specifiek toegewezen parkeerplekken. Binnen de WWD vallen deze parkeerplekken onder het type Parkeerplek type I;11-04-2025;;RUIMTESOORT.GEM;Vastgoed
RUIMTEDETAILSOORT;PUP;Parkeerplek in uitpandige afgesloten parkeergarage;Parpeerkplek in uitpandige en afgesloten parkeergarage behorend tot het complex met niet specifiek toegewezen parkeerplekken. Binnen de WWD vallen deze parkeerplekken onder het type Parkeerplek Type II;11-04-2025;;RUIMTESOORT.GEM;Vastgoed
RUIMTEDETAILSOORT;PBC;Parkeerplek buiten behorend bij complex;Paarkeerplek op een parkeerterrein behorend bij een complex met niet specifiek toegewezen parkeerplekken. Binnen de WWD vallen deze parkeerplekken onder het type Parkeerplek Type III;11-04-2025;;RUIMTESOORT.GEM;Vastgoed
